{
  "gatewayProfileId": "609a1b2c3d4e5f6a7b8c9d0e",
  "mode": {
    "type": "offline",
    "returnUrl": "https://example.com/path/abc123",
    "tokenId": "609a1b2c3d4e5f6a7b8c9d0e"
  },
  "amount": 1250,
  "currency": "EUR",
  "payableReference": "string",
  "payer": {
    "name": "Deliverect's Pizza Place",
    "email": "customer@example.com",
    "reference": "string",
    "ip": "string"
  },
  "payable": {
    "id": "609a1b2c3d4e5f6a7b8c9d0e"
  },
  "billingAddress": {
    "country": "BE",
    "city": "string",
    "postalCode": "string",
    "street": "string",
    "houseNumber": "string",
    "stateOrProvince": "string"
  },
  "captureMode": "immediate"
}